ID,Requirement_ID,Feature_Name,Category,Priority,Status,Start_Date,Due_Date,Estimated_Hours,Assigned_To,Description,Purpose,Success_Criteria,Implementation_Status,Next_Steps,Notes
1,HJ-ID1RS5,Password Protection & Login,Security,1,COMPLETED,2026-01-28,2026-01-29,3,AI,"Login modal with username/password, 3-strike lockout, demo mode, session enforcement","User authentication and session management","✓ Login modal ✓ 3-strike lockout ✓ Session enforcement ✓ Login logging",IMPLEMENTED,Ready for production deployment,"Tested: admin/admin, R18/R18, Maximus/Maximus, Joel/Joel"
2,HJ-ID1RS7,Admin User Management Panel,Administration,1,COMPLETED,2026-01-29,2026-01-29,6,AI,"Admin dashboard modal with tabs: Users|Logs|Sessions|Invitations. User CRUD, role management, password reset, login audit viewer","Centralized user administration, security oversight, activity tracking","✓ Admin dashboard modal ✓ User CRUD ✓ Role assignment ✓ Password reset ✓ Login logs ✓ Session management ✓ Admin logging",IMPLEMENTED,Live in Column 6 (Done),"All functions tested and working. Only visible to users with Admin role."
3,HJ-ID1RS10,Admin User Invitations,Administration,1,COMPLETED,2026-01-29,2026-01-29,6,AI,"Generate temp credentials, send via email or clipboard, track invitations, expiration logic, first-login password change","Streamline onboarding, provide controlled access, audit trail","✓ Temp credentials generation ✓ Email modal ✓ Mailto link ✓ Clipboard fallback ✓ Invitation tracking ✓ Expiration logic",IMPLEMENTED,Live in Column 6 (Done),"Email template with login instructions. Status tracking: Sent|Accepted|Revoked|Expired"
4,HJ-ID1RS8,Print Kanban Board,Export,1,NEW,2026-02-01,2026-02-05,5,TBD,"Print buttons in header + column headers. Full board (landscape), single column (portrait). Native print API. Metadata footer.","Export for meetings, archive board state, share with stakeholders","✓ Print Board button ✓ Print Column button ✓ Full board landscape ✓ Column portrait ✓ Metadata footer",NOT STARTED,Design → Implementation,"@media print CSS, no external libraries needed"
5,HJ-ID1RS9,Email Column Group,Communication,1,NEW,2026-02-05,2026-02-10,6,TBD,"Email button per column. Recipient selection (dropdown + text). Email template with task list. Mailto + clipboard. Email_Log.txt tracking.","Send column status to users, multi-role support, audit trail","✓ Email button ✓ Recipient selection ✓ Email template ✓ Mailto generation ✓ Clipboard fallback ✓ Email logging",NOT STARTED,Design → Implementation,"Extend validUsers with email field (already done). Log format: [timestamp]|TYPE|FROM|TO|TASK_IDS"
6,HJ-ID1RS3,Adaptive Kanban Device Detection,Responsive,2,IN_PROGRESS,2026-01-28,2026-02-01,3,AI,"Device detection: desktop vs tablet vs mobile. Drag-drop for desktop, dropdowns for mobile. Gold border for HJ ID# tasks.","Desktop drag-drop, mobile dropdowns, visual distinction for task types","✓ Desktop drag-drop ✓ Mobile dropdowns ✓ Gold borders ✓ Silent device switching",IMPLEMENTED,Testing on multiple devices,"Breakpoint 800px. Needs real device testing: iPad, iPhone, Android"
7,HJ-ID1RS4,Multi-Project Kanban,Organization,2,NEW,2026-02-10,2026-02-15,4,TBD,"Project dropdown filter in header. Filter per column. Create new project from UI. Task assignment to project. Priority-based sorting.","Multiple projects in same board, focus view, clear priorities","✓ Header project filter ✓ Column project filters ✓ Create project ✓ Reassign tasks ✓ Priority sorting",NOT STARTED,Design → Implementation,"Projects already have structure: {id, name, priority}. taskId already has projectId field."
8,HJ-ID1RS6,User Role Assignment to Tasks,Task Management,3,NEW,2026-02-15,2026-02-20,4,TBD,"Assignee dropdown in task modal. Display assigned user on card. Filter 'My Tasks'. Log assignments in Admin_Log.txt.","Assign tasks to users, track ownership, personal task filtering","✓ Assignee selector ✓ Display on card ✓ My Tasks filter ✓ Assignment logging",NOT STARTED,Requirements → Design,"Extend task: {assignee, assigneeEmail, assignedDate, assignedBy}"
9,HJ-ID0R1,Session Persistence,Core,1,COMPLETED,2026-01-29,2026-01-29,2,AI,"Save session to localStorage on login. Restore on page refresh. Clear on logout.","Stay logged in without re-entering credentials","✓ localStorage save on login ✓ Restore on refresh ✓ Clear on logout",IMPLEMENTED,In production,"Bug fix: Per-user lockout tracking also added"
10,HJ-ID0R2,Per-User Lockout Tracking,Security,1,COMPLETED,2026-01-29,2026-01-29,1,AI,"Track failed login attempts per user, not globally. 3 strikes per user, 5-min lockout.","Prevent one user's failures from locking out others","✓ Per-user attempt counting ✓ Individual lockouts ✓ Reset on page reload",IMPLEMENTED,In production,"Fixed critical bug where global lockout affected all users"
11,HJ-ID0R3,Invalid Credentials Recovery,Security,1,COMPLETED,2026-01-29,2026-01-29,1,AI,"Clear corrupted sessions from localStorage. Validate stored session before restoration.","Prevent login failures from corrupted cache","✓ Session validation ✓ Corrupted session detection ✓ Clear & recover",IMPLEMENTED,In production,"Added localStorage.removeItem() to logout function"
12,HJ-ID0R4,Update All Documentation,Documentation,2,COMPLETED,2026-01-29,2026-01-29,2,AI,"Create Documentation.csv consolidating all project files with metadata","Master documentation index","✓ CSV with 40+ entries ✓ Categories ✓ Status tracking ✓ Next steps",IMPLEMENTED,Committed to GitHub,"Documentation.csv created with all file types"
13,HJ-ID0R5,Design Phase Prep,Documentation,2,COMPLETED,2026-01-29,2026-01-29,3,AI,"Document full design specs for HJ-ID1RS7 and HJ-ID1RS10","Complete specifications before implementation","✓ HJ-ID1RS7D design ✓ HJ-ID1RS10D design ✓ Technical details",IMPLEMENTED,Committed to GitHub,"Detailed design specs in Design.txt"
14,SESSION1,Activity Log Creation,Documentation,2,COMPLETED,2026-01-29,2026-01-29,2,AI,"Create comprehensive session log with all commits, features, bugs, timeline","Track development progress and activities","✓ All commits documented ✓ Features listed ✓ Bugs logged ✓ Timeline included",IMPLEMENTED,Committed to GitHub,"ACTIVITY_LOG.txt created with full session details"
15,SESSION1,Design Prep Documentation,Planning,2,COMPLETED,2026-01-29,2026-01-29,2,AI,"Create design prep for HJ-ID1RS8, HJ-ID1RS9, HJ-ID1RS3, HJ-ID1RS4, HJ-ID1RS6","Ready for next phase implementations","✓ HJ-ID1RS8 design prep ✓ HJ-ID1RS9 design prep ✓ Implementation checklists",IMPLEMENTED,Committed to GitHub,"DESIGN_PREP.txt created with priority ranking"
================================================================================
LEGEND
================================================================================

CATEGORY: Feature category (Security, Administration, Export, Communication, Responsive, Organization, Task Management, Core, Documentation, Planning)

PRIORITY: 1=Critical/High, 2=Medium, 3=Low, 4=Nice-to-have

STATUS: NEW, DESIGN, IN_PROGRESS, COMPLETED, ON_HOLD, DEFERRED

IMPLEMENTATION_STATUS: NOT_STARTED, DESIGNED, IN_DEVELOPMENT, TESTING, IMPLEMENTED, PRODUCTION_READY

NEXT_STEPS: What comes next for this feature

NOTES: Additional context or implementation details

================================================================================
SUMMARY STATISTICS
================================================================================

Total Features: 15
Completed: 8 (53%)
In Progress: 1 (7%)
New: 5 (33%)
On Hold: 0 (0%)
Deferred: 1 (7%)

Estimated Total Hours Completed: 20 hours
Estimated Total Hours Remaining: 23-30 hours

Current Live Features: HJ-ID1RS5, HJ-ID1RS7, HJ-ID1RS10, Session Persistence, Lockout Tracking
Estimated Launch Date: 2026-02-15

================================================================================
